{
  "descriptorVersion": 1,
  "adapterId": "space-engineers",
  "slug": "space-engineers",
  "adapterVersion": "1.0.0",
  "sdkVersion": "1.4.0",
  "channel": "stable",
  "publishedAtUtc": "2026-09-13T19:18:20Z",
  "source": {
    "tag": "adapters/space-engineers/v1.0.0",
    "commit": "d780bdeebf2fc917ab4373fba409f9f8c51d8bed"
  },
  "package": {
    "fileName": "kontrol-adapter-space-engineers-1.0.0-win-x64.zip",
    "sha256": "B8F15EDA25712039A95B63052FD9502A02D97E9F380A52CFC79946E019DC0D40",
    "url": "https://komandio-labs.github.io/kontrol-adapters/packages/space-engineers/1.0.0/kontrol-adapter-space-engineers-1.0.0-win-x64.zip",
    "architecture": "x64"
  },
  "gameProductVersion": "steam-build-24675677",
  "assemblies": {
    "VRage.dll": {
      "fileVersion": "1.0.0.0",
      "sha256": "EC2410B3D916ADBD7404C3082CCC25A70C8BAEC89BACB57001C67597068E24CA",
      "mvid": "32e22621-4693-4285-918c-0a0f342b4d58"
    },
    "VRage.Game.dll": {
      "fileVersion": "1.0.0.0",
      "sha256": "F0970C2B60335F7690E158A485CD528703717C8C5002F2713556E04F09C508E1",
      "mvid": "6a9e1b61-7c42-4e4e-9d26-347bbf080924"
    },
    "VRage.Math.dll": {
      "fileVersion": "1.0.0.0",
      "sha256": "953ED575327FFEC5A72BAF13C893843C26F7D248CD1ECE1372EC34D650618F1C",
      "mvid": "5d141a5d-adcb-4d88-8ad4-3eb8dd11504c"
    },
    "Sandbox.Game.dll": {
      "fileVersion": "0.1.1",
      "sha256": "DE04E9162BCF87FC07CEC377213D99533BCFE1C34C9E1E2231168144C9D67EDF",
      "mvid": "438e5140-05de-4ad3-88bd-93cc699e77d0"
    }
  },
  "verifiedGameVersions": [
    "steam-build-24675677"
  ],
  "gameBuildIdentity": {
    "platform": "steam",
    "platformAppId": "244850",
    "platformBuildId": "24675677",
    "productVersion": null,
    "isProductVersionMeaningful": false,
    "fingerprintBuildId": null
  },
  "signature": "zfcglcZc6ZolQkO85IbGDUQyZ282my6x\u002BePgCL1uqEItukCwOSHWW3oHNObZRaVJAJCle14dKCPwsbe\u002BeHFsaA=="
}
