{
  "descriptorVersion": 1,
  "adapterId": "space-engineers-2",
  "slug": "space-engineers-2",
  "adapterVersion": "0.1.0-beta.1",
  "sdkVersion": "1.0.0",
  "channel": "beta",
  "publishedAtUtc": "2026-08-21T12:58:40Z",
  "source": {
    "tag": "adapters/space-engineers-2/v0.1.0-beta.1",
    "commit": "2e6f6ddcd270d982c50784dc5ed201a9e8c1b503"
  },
  "package": {
    "fileName": "kontrol-adapter-space-engineers-2-0.1.0-beta.1-win-x64.zip",
    "sha256": "67A9CC408EE63494E7260B911AFA7955B59F7537ACC88BC5C3ACD2AAF23BA22A",
    "url": "https://komandio-labs.github.io/kontrol-adapters/packages/space-engineers-2/0.1.0-beta.1/kontrol-adapter-space-engineers-2-0.1.0-beta.1-win-x64.zip",
    "architecture": "x64"
  },
  "gameProductVersion": "2.4.0.77",
  "assemblies": {
    "Game2.Client.dll": {
      "sha256": "296360843CD3ED707D5572124E93FB611F8869B4EA07B2953BB3D2116566E12E",
      "fileVersion": "2.3.0.2798"
    },
    "VRage.Core.dll": {
      "sha256": "4B14831F57DABD76F1DC6A6899B2D1CC310ED62830F83D4F9DABE85E6DD51683",
      "fileVersion": "2.3.0.2798"
    },
    "VRage.Library.dll": {
      "sha256": "02A6393FC3B0D4A57C1EA11B9C448A8EC21758D9E6F0B95F8A4B29F7B229B077",
      "fileVersion": "2.3.0.2798"
    }
  },
  "verifiedGameVersions": [
    "2.4.0.77",
    "2.3.0.2798"
  ],
  "signature": "p8bD0pK9uW0bbqeGjfA82tLHgA\u002BGB3KjkdDBtNNPFcdWJr9\u002BGFPvj2xiom8ipF\u002BlOc8xMu5hwi5XZbMmFzDV2Q=="
}
