{
  "descriptorVersion": 1,
  "adapterId": "space-engineers-2",
  "slug": "space-engineers-2",
  "adapterVersion": "0.2.0",
  "sdkVersion": "1.2.0",
  "channel": "stable",
  "publishedAtUtc": "2026-08-28T08:09:25Z",
  "source": {
    "tag": "adapters/space-engineers-2/v0.2.0",
    "commit": "e3a93ce95638e07302f40732601cb524526238c4"
  },
  "package": {
    "fileName": "kontrol-adapter-space-engineers-2-0.2.0-win-x64.zip",
    "sha256": "38BFFFDB1FB85DB6E71458693E5F8C2BC4D2B1B7DD23A8FDC74AB3554ED4816E",
    "url": "https://komandio-labs.github.io/kontrol-adapters/packages/space-engineers-2/0.2.0/kontrol-adapter-space-engineers-2-0.2.0-win-x64.zip",
    "architecture": "x64"
  },
  "gameProductVersion": "2.4.0.95",
  "assemblies": {
    "Game2.Client.dll": {
      "fileVersion": "2.4.0.95",
      "sha256": "FDCD1C1EB01433BE994C87893A88F720325BF93C1E797930D79859ED664BB9BA",
      "mvid": "f6e100aa-767e-4ff3-a5a5-4a694b657015"
    },
    "VRage.Core.dll": {
      "fileVersion": "2.4.0.95",
      "sha256": "46475534D89BC5E01C5247ADC7DD9C4EA08477B437DCAEDE1AB204B1976F7FA2",
      "mvid": "12a6700b-bf39-44af-bf8d-5613528583a1"
    },
    "VRage.Library.dll": {
      "fileVersion": "2.4.0.95",
      "sha256": "EA782B58E5D63D5F277D9BEB92CAA843D07239473C20F5220D1FABDCA5564E9D",
      "mvid": "b4ba2bb9-ffe0-48f1-88a8-58a672fd2b4b"
    }
  },
  "verifiedGameVersions": [
    "2.4.0.95",
    "2.4.0.93"
  ],
  "gameBuildIdentity": {
    "platform": "steam",
    "platformAppId": "1133870",
    "platformBuildId": "24993846",
    "productVersion": null,
    "isProductVersionMeaningful": false,
    "fingerprintBuildId": null
  },
  "signature": "b/I\u002BevFAapsTgVDFHI1jicKo2SJWto9P33onGj/744piTOupWV3ZarrpnTYOfozUQ\u002BdJkZY8O0jgf/DFlpVWow=="
}
