{
  "descriptorVersion": 1,
  "adapterId": "space-engineers",
  "slug": "space-engineers",
  "adapterVersion": "1.0.2",
  "sdkVersion": "1.5.0",
  "channel": "stable",
  "publishedAtUtc": "2026-10-23T13:09:12Z",
  "source": {
    "tag": "adapters/space-engineers/v1.0.2",
    "commit": "8ab8f724bb0e6dd47787b40daf5218024a707b57"
  },
  "package": {
    "fileName": "kontrol-adapter-space-engineers-1.0.2-win-x64.zip",
    "sha256": "5693CA6A9AA5397518BD021EC8F2A2EEF8AFCBB2D35C85BC799941FCD64E5AF1",
    "url": "https://komandio-labs.github.io/kontrol-adapters/packages/space-engineers/1.0.2/kontrol-adapter-space-engineers-1.0.2-win-x64.zip",
    "architecture": "x64"
  },
  "gameProductVersion": "1.210.014",
  "gameBuildIdentity": {
    "platform": "steam",
    "platformAppId": "244850",
    "platformBuildId": "24675677",
    "productVersion": "1.210.014",
    "isProductVersionMeaningful": true,
    "fingerprintBuildId": null
  },
  "assemblies": {
    "VRage.dll": {
      "sha256": "EC2410B3D916ADBD7404C3082CCC25A70C8BAEC89BACB57001C67597068E24CA",
      "fileVersion": "1.0.0.0"
    },
    "VRage.Game.dll": {
      "sha256": "F0970C2B60335F7690E158A485CD528703717C8C5002F2713556E04F09C508E1",
      "fileVersion": "1.0.0.0"
    },
    "VRage.Math.dll": {
      "sha256": "953ED575327FFEC5A72BAF13C893843C26F7D248CD1ECE1372EC34D650618F1C",
      "fileVersion": "1.0.0.0"
    },
    "Sandbox.Game.dll": {
      "sha256": "DE04E9162BCF87FC07CEC377213D99533BCFE1C34C9E1E2231168144C9D67EDF",
      "fileVersion": "0.1.1"
    }
  },
  "verifiedGameVersions": [
    "1.210.014"
  ],
  "signature": "60F\u002BwIuwQDhexWILpq6Jdkt6HBX9sgEmYbZxUbF1/kfvZN7kNoQ1uV5Q0fSA7PwGEDMhsdZu6N8Qqo\u002BwxH0EBg=="
}
