{
  "descriptorVersion": 1,
  "adapterId": "space-engineers-2",
  "slug": "space-engineers-2",
  "adapterVersion": "0.4.2",
  "sdkVersion": "1.5.0",
  "channel": "stable",
  "publishedAtUtc": "2026-10-23T13:12:15Z",
  "source": {
    "tag": "adapters/space-engineers-2/v0.4.2",
    "commit": "8ab8f724bb0e6dd47787b40daf5218024a707b57"
  },
  "package": {
    "fileName": "kontrol-adapter-space-engineers-2-0.4.2-win-x64.zip",
    "sha256": "67F78679A909C3100811874ABBB61683B952367756D0B524BC06B181AE58AA0E",
    "url": "https://komandio-labs.github.io/kontrol-adapters/packages/space-engineers-2/0.4.2/kontrol-adapter-space-engineers-2-0.4.2-win-x64.zip",
    "architecture": "x64"
  },
  "gameProductVersion": "4.0.0.3165",
  "gameBuildIdentity": {
    "platform": "steam",
    "platformAppId": "1133870",
    "platformBuildId": "26163761",
    "productVersion": "4.0.0.3165",
    "isProductVersionMeaningful": true,
    "fingerprintBuildId": null
  },
  "assemblies": {
    "Game2.Client.dll": {
      "fileVersion": "4.0.0.3165",
      "sha256": "A0703A24EEE08D3259535A38A620C78253231210141D615A1F434284CD5ED9FD",
      "mvid": "23a9090e-55e8-40df-ab54-b8db20ede5e7"
    },
    "VRage.Core.dll": {
      "fileVersion": "4.0.0.3165",
      "sha256": "7B9DD7A1F91A4B39507FC9728C6866FD2816D17EED344B2F9D528694982E0D8B",
      "mvid": "67c23130-dcaf-412e-8238-5a0e27fe2c06"
    },
    "VRage.Library.dll": {
      "fileVersion": "4.0.0.3165",
      "sha256": "8213CCBA9D641821155ED590E0815E303235E829814D11E90C6137D2114970FF",
      "mvid": "a3cfc5c3-5362-41c8-9c90-8cff3b13e941"
    }
  },
  "verifiedGameVersions": [
    "4.0.0.3165",
    "4.0.0.3159"
  ],
  "signature": "EDrJQWSqEoLEm5kxmaS82EZ7atsZjYPEsAXhnAspERBy/dRI8CfP31\u002BEcPovePsOFY/sQ9M0Rx/QvBIkJbWbBQ=="
}
