{
  "descriptorVersion": 1,
  "adapterId": "space-engineers-2",
  "slug": "space-engineers-2",
  "adapterVersion": "0.1.0",
  "sdkVersion": "1.1.0",
  "channel": "stable",
  "publishedAtUtc": "2026-08-24T09:46:39Z",
  "source": {
    "tag": "adapters/space-engineers-2/v0.1.0",
    "commit": "8680e53b8ba239cd7c77faaee30304a25beb79db"
  },
  "package": {
    "fileName": "kontrol-adapter-space-engineers-2-0.1.0-win-x64.zip",
    "sha256": "87D15573B050FB0E791BDD8B3924DF3A797AA28FCDF2BA5165B19978CD08839C",
    "url": "https://komandio-labs.github.io/kontrol-adapters/packages/space-engineers-2/0.1.0/kontrol-adapter-space-engineers-2-0.1.0-win-x64.zip",
    "architecture": "x64"
  },
  "gameProductVersion": "2.4.0.93",
  "assemblies": {
    "Game2.Client.dll": {
      "fileVersion": "2.4.0.93",
      "sha256": "A7112EEFC83564325C67606D3691164B56D36EF343277BB4C21FB65692059FBE",
      "mvid": "4f7d4986-abee-49db-bb71-1d0d43135138"
    },
    "VRage.Core.dll": {
      "fileVersion": "2.4.0.93",
      "sha256": "0DC53E54435497CF251A13C9B8C2CA871FEA4D28E0FC82AEE7AEC5A004AB5710",
      "mvid": "2dd2c9fa-dae0-41f1-a823-b5b4e45411b0"
    },
    "VRage.Library.dll": {
      "fileVersion": "2.4.0.93",
      "sha256": "0729CE92BD8F32F5979E0C211C31C376507E44D04B85834C5EF40C0FB2D6A05B",
      "mvid": "ff2e1fbb-6878-47e0-be5d-52eb82038fc7"
    }
  },
  "verifiedGameVersions": [
    "2.4.0.93",
    "2.4.0.86",
    "2.4.0.77",
    "2.3.0.2798"
  ],
  "gameBuildIdentity": {
    "platform": "steam",
    "platformAppId": "1133870",
    "platformBuildId": "24972061",
    "productVersion": null,
    "isProductVersionMeaningful": false,
    "fingerprintBuildId": null
  },
  "signature": "TJraZgjo\u002B1e3Q8gtkZrBJ8WkYKyk39I3HESSh1FUaipL6diPgJpGHfQYme057oRXSiFvyAWQ8CqtwKegMIC0zQ=="
}
