{
  "descriptorVersion": 1,
  "adapterId": "space-engineers-2",
  "slug": "space-engineers-2",
  "adapterVersion": "0.4.1",
  "sdkVersion": "1.4.0",
  "channel": "stable",
  "publishedAtUtc": "2026-09-27T10:08:51Z",
  "source": {
    "tag": "adapters/space-engineers-2/v0.4.1",
    "commit": "c10b9c434c92b66fd413a040d95ff2adab4f7ae6"
  },
  "package": {
    "fileName": "kontrol-adapter-space-engineers-2-0.4.1-win-x64.zip",
    "sha256": "C9FC4285A8C1CFC91E957D6318FF15410739A4F6B5626E7F6F850F8C5FBAE1E3",
    "url": "https://komandio-labs.github.io/kontrol-adapters/packages/space-engineers-2/0.4.1/kontrol-adapter-space-engineers-2-0.4.1-win-x64.zip",
    "architecture": "x64"
  },
  "gameProductVersion": "2.4.0.95",
  "gameBuildIdentity": {
    "platform": "steam",
    "platformAppId": "1133870",
    "platformBuildId": "24993846",
    "productVersion": "2.4.0.95",
    "isProductVersionMeaningful": true,
    "fingerprintBuildId": null
  },
  "assemblies": {
    "Game2.Client.dll": {
      "fileVersion": "2.4.0.95",
      "sha256": "FDCD1C1EB01433BE994C87893A88F720325BF93C1E797930D79859ED664BB9BA",
      "mvid": "f6e100aa-767e-4ff3-a5a5-4a694b657015"
    },
    "VRage.Core.dll": {
      "fileVersion": "2.4.0.95",
      "sha256": "46475534D89BC5E01C5247ADC7DD9C4EA08477B437DCAEDE1AB204B1976F7FA2",
      "mvid": "12a6700b-bf39-44af-bf8d-5613528583a1"
    },
    "VRage.Library.dll": {
      "fileVersion": "2.4.0.95",
      "sha256": "EA782B58E5D63D5F277D9BEB92CAA843D07239473C20F5220D1FABDCA5564E9D",
      "mvid": "b4ba2bb9-ffe0-48f1-88a8-58a672fd2b4b"
    }
  },
  "verifiedGameVersions": [
    "2.4.0.95"
  ],
  "signature": "BVvPunlXmRfP3KL7aJIcX2mnz2lhXbrxOsMJBXmuIkPMyxuA\u002B5poDSDZiUCckzix3/BjSWLDKEbkyjt24YhZtw=="
}
